qid	original_query	query_variant_1	query_variant_2	query_variant_3	query_variant_4	query_variant_5	query_variant_6	query_variant_7	query_variant_8	query_variant_9	query_variant_10	query_variant_11	query_variant_12	query_variant_13	query_variant_14	query_variant_15	query_variant_16	query_variant_17	query_variant_18	query_variant_19	query_variant_20
1030303	who is aziz hashim	 who is aziz hashim	who is aziz hashim	who is aziz hashim	who is aziz hashim	who is aziz hashim	who is aziz hashim	who is aziz hashim	who is aziz hashim	who is aziz hashim	who is aziz hashim	who is aziz hashim	who is aziz hashim	who is aziz hashim	who is aziz hashim	who is aziz hashim	who is aziz hashim	who is aziz hashim	who is aziz hashim	who is aziz hashim	who is aziz hashim
1037496	who is rep scalise	 who is rep  steve scalise	rep  steve scalise bio	who is the house majority whip	steve scalise louisiana	rep  scalise contact	steve scalise biography	who is the republican whip	steve scalise wiki	rep  steve scalise facts	steve scalise political party	rep  scalise district	steve scalise family	who is the representative for louisiana	steve scalise news	rep  scalise office	steve scalise education	who is the house republican whip	steve scalise speech	rep  steve scalise voting record	steve scalise awards
1043135	who killed nicholas ii of russia	 who killed nicholas ii of russia	who assassinated nicholas ii of russia	who murdered nicholas ii of russia	who was responsible for the death of nicholas ii of russia	who killed the last russian tsar	who assassinated the romanov family	who was involved in the murder of nicholas ii	who was the assassin of nicholas ii	who was responsible for the execution of nicholas ii	who killed the russian royal family	who was involved in the killing of nicholas ii	who carried out the assassination of nicholas ii	who was the mastermind behind the murder of nicholas ii	who was responsible for the death of the romanov family	who was the last person to see nicholas ii alive	who was the one who killed nicholas ii	who was the perpetrator of the murder of nicholas ii	who was involved in the execution of nicholas ii	who was the one who assassinated nicholas ii	who was the mastermind behind the execution of nicholas ii
1051399	who sings monk theme song	 who sings monk theme song	who sings theme song of monk	who performs monk theme	who sings monk tv show theme	who is the singer of monk theme song	who does the theme song for monk	who sings the monk theme	who is the vocalist of monk theme	who sings the monk tv show theme	who does the music for monk	who is the composer of monk theme	who sings the theme of monk	who is the artist of monk theme song	who sings the monk opening theme	who does the opening theme of monk	who sings the main theme of monk	who is the singer of the monk main theme	who sings the monk show theme	who does the show theme of monk	who sings the monk main theme song
1064670	why do hunters pattern their shotguns	 why do hunters pattern their shotguns for accuracy	why do hunters pattern their shotguns before hunting	why do hunters pattern their shotguns for deer hunting	why do hunters pattern their shotguns for waterfowl hunting	why do hunters pattern their shotguns with specific chokes	why do hunters pattern their shotguns for turkey hunting	why do hunters pattern their shotguns for upland game hunting	why do hunters pattern their shotguns for target shooting	why do hunters pattern their shotguns to increase range	why do hunters pattern their shotguns to improve pattern density	why do hunters pattern their shotguns to reduce shot scatter	why do hunters pattern their shotguns for hunting small game	why do hunters pattern their shotguns for hunting large game	why do hunters pattern their shotguns with specific ammunition	why do hunters pattern their shotguns for hunting in dense cover	why do hunters pattern their shotguns for hunting in open areas	why do hunters pattern their shotguns to improve shot placement	why do hunters pattern their shotguns for hunting at close range	why do hunters pattern their shotguns for hunting at long range	why do hunters pattern their shotguns to optimize shotgun performance 
1071750	why is pete rose banned from hall of fame	 why is pete rose banned from baseball hall of fame	what led to pete rose s hall of fame ban	why was pete rose denied hall of fame	what was the reason for pete rose s hall of fame exclusion	why did pete rose get banned from the baseball hall of fame	what rule did pete rose break to be banned from hall of fame	how did pete rose s betting scandal affect his hall of fame chances	why did the baseball hall of fame voters reject pete rose	what is the significance of pete rose s ban from the hall of fame	why did pete rose s career achievements not guarantee his hall of fame induction	what is the impact of pete rose s ban on his legacy	why did pete rose s actions lead to his hall of fame exclusion	what are the implications of pete rose s ban from the hall of fame	how does pete rose s ban from the hall of fame reflect on the sport	why did pete rose s personal life affect his hall of fame chances	what is the role of the baseball hall of fame in pete rose s ban	why did pete rose s fans feel betrayed by his ban	what is the moral lesson from pete rose s ban from the hall of fame	why did pete rose s teammates and opponents have mixed reactions to his ban	what are the consequences of pete rose s ban from the hall of fame
1105792	define geon	 define geon	define geon	define geon	define geon	define geon	define geon	define geon	define geon	define geon	define geon	define geon	define geon	define geon	define geon	define geon	define geon	define geon	define geon	define geon	define geon
1106979	define pareto chart in statistics	 define pareto chart in statistics	define pareto chart in statistics	define pareto chart in statistics	define pareto chart in statistics	define pareto chart in statistics	define pareto chart in statistics	define pareto chart in statistics	define pareto chart in statistics	define pareto chart in statistics	define pareto chart in statistics	define pareto chart in statistics	define pareto chart in statistics	define pareto chart in statistics	define pareto chart in statistics	define pareto chart in statistics	define pareto chart in statistics	define pareto chart in statistics	define pareto chart in statistics	define pareto chart in statistics	define pareto chart in statistics
1108651	what the best way to get clothes white	 best way to get clothes white and bright	most effective method to whiten clothes	how to get clothes super white	whitening clothes without bleach	best laundry tips to get clothes white	how to remove yellow stains from white clothes	best stain remover for white clothes	whitening clothes at home	how to get old clothes white again	best laundry detergent for whitening clothes	tips to keep white clothes looking new	how to whiten clothes with baking soda	best way to get white clothes looking like new	how to remove dinginess from white clothes	whitening clothes with hydrogen peroxide	best method to get clothes snow white	how to get stubborn stains out of white clothes	whitening clothes with oxygen bleach	best way to keep white clothes white	how to get white clothes looking bright and new
1109707	what medium do radio waves travel through	 what medium do radio waves travel through air	what medium do radio waves travel through atmosphere	what medium do radio waves travel through vacuum	what medium do radio waves travel through space	what medium do radio waves travel through solid	what medium do radio waves travel through liquid	what medium do radio waves travel through plasma	what medium do radio waves travel through ionosphere	what medium do radio waves travel through magnetosphere	what medium do radio waves travel through earth s atmosphere	what medium do radio waves travel through earth s crust	what medium do radio waves travel through ocean	what medium do radio waves travel through water	what medium do radio waves travel through soil	what medium do radio waves travel through rock	what medium do radio waves travel through metal	what medium do radio waves travel through glass	what medium do radio waves travel through wood	what medium do radio waves travel through fiber optic	what medium do radio waves travel through human body
1110678	what is the un fao	 what is the united nations food and agriculture organization	what is the un s food and agriculture organization	what is the fao of the un	what is the un s agency for food and agriculture	what is the un s food and agriculture department	what is the un s food security agency	what is the un s agricultural organization	what is the un s food and nutrition agency	what is the un s sustainable agriculture organization	what is the un s global food organization	what is the un s agricultural development organization	what is the un s food and agriculture research organization	what is the un s international food and agriculture organization	what is the un s food and agriculture policy organization	what is the un s global agricultural organization	what is the un s food and nutrition research organization	what is the un s sustainable food and agriculture organization	what is the un s food and agriculture innovation organization	what is the un s global food security organization	what is the un s agricultural innovation organization
1113256	what is reba mcentire s net worth	 what is reba mcentire s net worth	what is reba mcentire s net worth	what is reba mcentire s net worth	what is reba mcentire s net worth	what is reba mcentire s net worth	what is reba mcentire s net worth	what is reba mcentire s net worth	what is reba mcentire s net worth	what is reba mcentire s net worth	what is reba mcentire s net worth	what is reba mcentire s net worth	what is reba mcentire s net worth	what is reba mcentire s net worth	what is reba mcentire s net worth	what is reba mcentire s net worth	what is reba mcentire s net worth	what is reba mcentire s net worth	what is reba mcentire s net worth	what is reba mcentire s net worth	what is reba mcentire s net worth
1115210	what is chaff and flare	 what is chaff and flare definition	what is chaff and flare used for	chaff and flare explanation	what is chaff and flare in military	chaff and flare meaning	what is chaff and flare used for in aviation	chaff and flare vs decoy	what is chaff and flare in air defense	chaff and flare examples	what is chaff and flare in warfare	chaff and flare vs smoke	what is chaff and flare in electronic warfare	chaff and flare system	what is chaff and flare in aircraft	chaff and flare vs radar	what is chaff and flare in naval warfare	chaff and flare components	what is chaff and flare in military operations	chaff and flare technology	what is chaff and flare in electronic countermeasures
1116380	what is a nonconformity earth science	 what is a nonconformity earth science	definition of nonconformity earth science	what is nonconformity in earth science	earth science nonconformity examples	nonconformity earth science definition	what is the meaning of nonconformity in earth science	earth science nonconformity types	nonconformity in earth science geology	earth science nonconformity examples in geology	nonconformity earth science significance	what is nonconformity in earth science geology	earth science nonconformity characteristics	nonconformity earth science concepts	what is the concept of nonconformity in earth science	earth science nonconformity applications	nonconformity earth science importance	what is the importance of nonconformity in earth science	earth science nonconformity problems	nonconformity earth science challenges	what are the challenges of nonconformity in earth science
1121353	what can you do about discrimination in the workplace in oklahoma city	 what can you do about racial discrimination in the workplace in oklahoma city 	what can you do about age discrimination in the workplace in oklahoma city 	what can you do about gender discrimination in the workplace in oklahoma city 	what can you do about sexual orientation discrimination in the workplace in oklahoma city 	what can you do about disability discrimination in the workplace in oklahoma city 	what can you do about religious discrimination in the workplace in oklahoma city 	what can you do about national origin discrimination in the workplace in oklahoma city 	what can you do about retaliation for reporting discrimination in the workplace in oklahoma city 	what can you do about harassment in the workplace in oklahoma city 	what can you do about hostile work environment in the workplace in oklahoma city 	what can you do about bullying in the workplace in oklahoma city 	what can you do about discrimination against employees in oklahoma city 	what can you do about discrimination against job applicants in oklahoma city 	what can you do about workplace discrimination laws in oklahoma city 	what can you do about oklahoma city discrimination laws 	what can you do about oklahoma city employment laws 	what can you do about discrimination in the workplace in okc 	what can you do about workplace harassment in oklahoma city 	what can you do about unfair treatment in the workplace in oklahoma city 	what can you do about unequal treatment in the workplace in oklahoma city 
1122767	what amino produces carnitine	 what amino acid produces carnitine	which amino acid is converted to carnitine	what amino acid is precursor to carnitine	carnitine biosynthesis from which amino acid	which amino acid is used to make carnitine	amino acid that yields carnitine	carnitine synthesis from amino acid	which amino acid is converted into carnitine	amino acid precursor to carnitine biosynthesis	what amino acid is the starting material for carnitine production	which amino acid is the primary source of carnitine	carnitine production from amino acid	amino acid that is converted to carnitine	what amino acid is the substrate for carnitine synthesis	which amino acid is the main source of carnitine	carnitine biosynthesis from amino acid	amino acid conversion to carnitine	what amino acid is used to produce carnitine	which amino acid is the key to carnitine production	carnitine synthesis from amino acid
1127540	meaning of shebang	 meaning of shebang in programming	what does shebang mean in code	definition of shebang in computing	interpretation of shebang in scripting	shebang command meaning	what is shebang used for	shebang syntax definition	shebang line meaning	meaning of hashbang in scripting	what is shebang in programming languages	shebang symbol meaning	shebang line explanation	meaning of bang in shebang	shebang directive definition	what is the purpose of shebang	shebang usage meaning	shebang format definition	meaning of #  in programming	what is the role of shebang	shebang in shell scripting meaning
1131069	how many sons robert kraft has	 how many sons does robert kraft have	sons of robert kraft	number of sons robert kraft	robert kraft s sons	sons robert kraft has	how many children robert kraft has	children of robert kraft	robert kraft family	robert kraft s family	sons robert kraft	robert kraft s son count	robert kraft children	kraft sons	robert kraft s kids	sons of new england patriots owner	new england patriots owner sons	robert kraft offspring	robert kraft s offspring	kraft children	robert kraft s family members
1132532	average annual income data analyst	 average annual income data analyst	average annual income data analyst	average annual income data analyst	average annual income data analyst	average annual income data analyst	average annual income data analyst	average annual income data analyst	average annual income data analyst	average annual income data analyst	average annual income data analyst	average annual income data analyst	average annual income data analyst	average annual income data analyst	average annual income data analyst	average annual income data analyst	average annual income data analyst	average annual income data analyst	average annual income data analyst	average annual income data analyst	average annual income data analyst
1133579	how does granulation tissue start	 how does granulation tissue start in humans	what triggers granulation tissue formation	initiation of granulation tissue	what causes granulation tissue to form	granulation tissue development stages	how granulation tissue forms in wounds	what is the process of granulation tissue formation	initiation of granulation tissue in burns	what triggers granulation tissue formation in diabetes	granulation tissue formation in chronic wounds	what causes granulation tissue to form in skin	how granulation tissue forms in pressure ulcers	initiation of granulation tissue in surgical wounds	what is the mechanism of granulation tissue formation	granulation tissue formation in acute wounds	how granulation tissue forms in chronic skin ulcers	what triggers granulation tissue formation in obese patients	initiation of granulation tissue in venous ulcers	what causes granulation tissue to form in patients with peripheral artery disease	how granulation tissue forms in traumatic wounds
1136043	difference between a hotel and motel	 difference between luxury hotel and budget motel	what s the distinction between a hotel and a motel	how do hotels differ from motels	what are the key differences between a hotel and a motel	difference between hotel accommodations and motel rooms	what s the main difference between a hotel and a motel	differences between hotels and motels in terms of amenities	what s the distinction between a luxury hotel and a budget motel	how do hotels and motels differ in terms of services	difference between a hotel and a motel in terms of pricing	what s the difference between a hotel and a motel in terms of location	differences between hotels and motels in terms of facilities	what s the main difference between a hotel and a motel in terms of cleanliness	differences between hotels and motels in terms of staff	what s the difference between a hotel and a motel in terms of food	difference between a hotel and a motel in terms of parking	what s the distinction between a hotel and a motel in terms of safety	how do hotels and motels differ in terms of entertainment options	difference between a hotel and a motel in terms of business facilities	what s the difference between a hotel and a motel in terms of leisure activities
1136047	difference between a company s strategy and business model is	 key differences between a company s strategy and business model	distinct features of a company s strategy versus business model	comparison of a company s strategy and business model	unique aspects of a company s strategy and business model	what sets a company s strategy apart from its business model	strategic vs business model differences for a company	company strategy vs business model definition	distinguishing features of a company s strategy and business model	company business model vs strategy explanation	key takeaways from a company s strategy and business model	company strategy and business model alignment	role of strategy in a company s business model	company business model strategy implementation	company strategy and business model fit	differences in a company s strategy and business model	company business model strategy vs operational plan	company strategy and business model integration	company business model strategy and competitive advantage	company strategy vs business model and market positioning	company business model strategy and value proposition
1136962	why did the ancient egyptians call their land kemet or black land	 why did ancient egyptians specifically call their land kemet	why did egyptians use black land as a nickname	what was the significance of kemet in ancient egyptian culture	why did egyptians refer to their land as black land	what does the name kemet mean in ancient egyptian language	why was the black land a significant term in ancient egypt	what was the purpose of calling egypt kemet	why was kemet an important term in ancient egyptian history	what did the black land represent in ancient egyptian society	why did egyptians use the term black land to describe their land	what was the meaning of black land in ancient egypt	why did ancient egyptians use the term kemet	what was the significance of the black land in ancient egypt	why did egyptians call their land the black land	what does kemet mean in the context of ancient egypt	why was the term black land used in ancient egypt	what was the importance of kemet in ancient egypt	why did egyptians refer to their land as the black land	what was the significance of the name kemet	why was kemet an important term in ancient egyptian culture
118440	define bmt medical	 define bmt medical centre	what is bmt medical	explain bmt medical concept	bmt medical definition	what is bmt medical treatment	bmt medical services definition	bmt medical care explanation	bmt medical centre definition	definition of bmt medical care	what is bmt medical care	bmt medical treatment definition	bmt medical services explanation	bmt medical concept definition	what is bmt medical services	definition of bmt medical treatment	bmt medical care explanation	bmt medical centre services definition	bmt medical definition explanation	what is bmt medical centre	bmt medical services definition explanation
121171	define etruscans	 define ancient etruscans	ettruiscan definition	what are etruscans	description of etruscan civilization	etruiscan people definition	define etruscan culture	what is etruscan history	etruiscan definition simple	explain etruscans	define etruscan language	etruiscan meaning	definition of etruscan art	what does etruscan mean	etruiscan definition brief	define etruscan architecture	etruiscan civilization definition	what are etruscan ruins	define etruscan mythology	etruiscan definition concise	define etruscan society
135802	definition of laudable	 definition of laudable characteristics	definition of a laudable trait	definition of what is laudable	definition of something laudable	laudable definition examples	definition of laudable behavior	definition of laudable qualities	laudable definition in english	definition of laudable in dictionary	laudable definition synonyms	definition of laudable in business	definition of laudable in education	laudable definition in psychology	definition of laudable in ethics	definition of laudable in leadership	definition of laudable in management	definition of laudable in social work	definition of laudable in healthcare	definition of laudable in communication	definition of laudable in marketing
141630	describe how muscles and bones work together to produce movement	 describe how skeletal muscles and bones work together to produce movement	explain how muscles and bones collaborate to generate movement	describe the partnership between muscles and bones in producing movement	explain how bones and muscles interact to produce movement	describe the role of muscles and bones in producing voluntary movement	explain how muscles and bones work together to facilitate movement	describe the coordination between muscles and bones in producing movement	explain how bones and muscles collaborate to produce joint movement	describe the relationship between muscles and bones in producing movement	explain how muscles and bones interact to produce skeletal movement	describe the mechanics of how muscles and bones work together to produce movement	explain how bones and muscles function together to produce movement	describe the physiology of how muscles and bones work together to produce movement	explain how muscles and bones coordinate to produce movement	describe the anatomy of how muscles and bones work together to produce movement	explain how bones and muscles work together to produce gross movement	describe the biomechanics of how muscles and bones work together to produce movement	explain how muscles and bones interact to produce fine movement	describe the kinesiology of how muscles and bones work together to produce movement	explain how bones and muscles collaborate to produce locomotion
156498	do google docs auto save	 do google docs automatically save	does google docs auto save	is google docs auto save feature	does google docs save automatically	how often does google docs auto save	what happens if i close google docs without saving	can i disable google docs auto save	how to turn off google docs auto save	can i customize google docs auto save interval	does google docs auto save revisions	does google docs save drafts	does google docs auto save on mobile	does google docs auto save offline	does google docs auto save on desktop	can i pause google docs auto save	can i cancel google docs auto save	does google docs auto save when browser crashes	does google docs auto save when computer shuts down	does google docs auto save when network connection lost	can i schedule google docs auto save
169208	does mississippi have an income tax	 does mississippi have an income tax 	income tax in mississippi	mississippi state income tax	is mississippi an income tax state	mississippi income tax rate	do i need to pay income tax in mississippi	income tax mississippi residents	mississippi income tax filing	mississippi state income tax return	do i have to pay income tax in mississippi	income tax mississippi laws	mississippi income tax laws	income tax in mississippi state	mississippi income tax requirements	do i need to file income tax in mississippi	income tax mississippi filing	mississippi state income tax filing	mississippi income tax filing requirements	income tax in mississippi state government	mississippi income tax forms
