qid	original_query	query_variant_1	query_variant_2	query_variant_3	query_variant_4	query_variant_5	query_variant_6	query_variant_7	query_variant_8	query_variant_9	query_variant_10	query_variant_11	query_variant_12	query_variant_13	query_variant_14	query_variant_15	query_variant_16	query_variant_17	query_variant_18	query_variant_19	query_variant_20
1030303	who is aziz hashim	 who is aziz hashim 	what is the identity of aziz hashim 	"who are we talking about, aziz hashim "	can you tell me about aziz hashim 	who is the person known as aziz hashim 	introduce me to aziz hashim	who is the individual behind the name aziz hashim 	tell me about the person aziz hashim	who is the personality known as aziz hashim 	who is the individual referred to as aziz hashim 	can you provide information on aziz hashim 	who is this aziz hashim 	introduce aziz hashim	who is the entity known as aziz hashim 	who is the being referred to as aziz hashim 	who is the individual known for aziz hashim 	what do we know about aziz hashim 	who is the human being known as aziz hashim 	who is the entity referred to as aziz hashim 	who is the personage known as aziz hashim 
1037496	who is rep scalise	 who is representative steve scalise 	"who is representative steve scalise, a us politician "	who is the republican representative from louisiana 	who is the louisiana congressman 	who is the representative from louisiana s 1st congressional district 	"who is steve scalise, the republican representative "	who is the congressman for louisiana s 1st district 	"who is representative scalise, a louisiana politician "	who is the republican congressman from louisiana 	who is the representative from louisiana s congressional district 1 	"who is steve scalise, the congressman from louisiana "	who is the louisiana representative from the 1st district 	"who is representative steve scalise, a louisiana representative "	who is the representative from the 1st congressional district of louisiana 	"who is steve scalise, a louisiana congressman "	who is the congressman for louisiana s 1st congressional district 	"who is representative scalise, a us representative from louisiana "	who is the louisiana congressman for the 1st district 	"who is representative steve scalise, a republican representative "	"who is the representative from louisiana s 1st congressional district, steve scalise "
1043135	who killed nicholas ii of russia	 who was responsible for the assassination of nicholas ii of russia 	who assassinated the last russian tsar 	who was the killer of nicholas ii 	"who murdered nicholas ii, the russian monarch "	who was behind the death of nicholas ii 	"who executed nicholas ii, the russian emperor "	who was the mastermind behind nicholas ii s death 	who was the assassin of nicholas ii 	who was the one who killed nicholas ii 	who was the culprit behind nicholas ii s assassination 	who was the person responsible for nicholas ii s demise 	who was the killer of the russian tsar 	who was the one who murdered nicholas ii 	who was the perpetrator of nicholas ii s death 	who was the brains behind nicholas ii s assassination 	who was the one who executed nicholas ii 	who was the key player in nicholas ii s murder 	who was the driving force behind nicholas ii s demise 	who was the main culprit in nicholas ii s assassination 	who was the one who orchestrated nicholas ii s death 
1051399	who sings monk theme song	 who is responsible for singing the theme song of monk 	who performs the theme song of monk 	who sings the iconic monk theme song 	who is behind the monk theme song vocals 	who provides the vocal accompaniment for monk s theme song 	who does the singing for monk s theme song 	who is the vocalist on monk s theme song 	who sings the catchy monk theme song 	who performs the memorable monk theme song 	who is the singer of the monk theme song 	who has recorded the monk theme song 	who sings the popular monk theme song 	who does the vocals for monk s theme song 	who is the main singer on monk s theme song 	who has a hand in singing monk s theme song 	who sings the iconic tune of monk 	who is responsible for the vocals of monk s theme song 	who has a role in singing monk s theme song 	who sings the recognizable monk theme song 	who performs the recognizable monk theme song 
1064670	why do hunters pattern their shotguns	 why do hunters customize their shotgun patterns 	what is the purpose of modifying shotgun dispersion 	how do hunters optimize their shotgun shot patterns 	what do hunters aim to achieve with shotgun pattern adjustments 	why do hunters fine tune their shotgun firing patterns 	what is the significance of shotgun pattern customization 	how do hunters regulate their shotgun shot groupings 	what is the goal of shotgun pattern refinement 	why do hunters calibrate their shotgun firing patterns 	what is the importance of shotgun pattern optimization 	how do hunters tailor their shotgun shot patterns 	what do hunters try to accomplish with shotgun pattern modifications 	why do hunters adjust their shotgun firing patterns 	what is the function of shotgun pattern tuning 	how do hunters fine tune their shotgun shot patterns 	what is the purpose of shotgun pattern calibration 	why do hunters optimize their shotgun shot groupings 	what do hunters aim to achieve with shotgun pattern adjustments 	how do hunters modify their shotgun firing patterns 	what is the significance of shotgun pattern fine tuning 
1071750	why is pete rose banned from hall of fame	 why is pete rose excluded from the baseball hall of fame	what s the reason pete rose isn t in the hall of fame	why was pete rose denied entry into the hall of fame	what led to pete rose s exclusion from the hall of fame	why is pete rose not a hall of famer	how did pete rose get banned from the hall of fame	what s the story behind pete rose s hall of fame omission	why is pete rose s name missing from the hall of fame	what s the reason for pete rose s non induction into the hall of fame	why didn t pete rose get inducted into the hall of fame	what s the controversy surrounding pete rose s hall of fame eligibility	why is pete rose not a member of the hall of fame	what s the history behind pete rose s hall of fame exclusion	why was pete rose not voted into the hall of fame	what s the reason for pete rose s absence from the hall of fame	why didn t pete rose get the nod for the hall of fame	what s the reason behind pete rose s non selection for the hall of fame	why is pete rose not in the hall of fame	what s the story behind pete rose s non induction into the hall of fame	why was pete rose denied the hall of fame honor
1105792	define geon	 define geon	explain the meaning of geon	geon  a definition	what is geon 	describe the concept of geon	geon s significance	define the term geon	interpret geon	elucidate geon	geon s essence	define  geon 	geon s meaning	describe geon	geon s definition	geon s significance	explain geon	geon s essence	define geon concept	geon s meaning and significance	define geon term
1106979	define pareto chart in statistics	 explain pareto chart in statistics	describe the concept of pareto chart in statistical analysis	outline the meaning of pareto chart in data visualization	define pareto chart in statistical terminology	summarize the idea of pareto chart in data science	characterize the pareto chart in statistical context	pareto chart definition in statistics	interpret the concept of pareto chart in statistical studies	what is the significance of pareto chart in statistical research	elucidate the meaning of pareto chart in statistics	pareto chart explanation in statistical methodology	describe the importance of pareto chart in data analysis	break down the concept of pareto chart in statistical framework	define pareto chart in statistical data visualization	summarize the concept of pareto chart in statistical theory	outline the role of pareto chart in statistical modeling	pareto chart meaning in statistical context	explain the concept of pareto chart in statistical practice	characterize the pareto chart in statistical applications	define pareto chart in statistical data exploration
1108651	what the best way to get clothes white	 what is the most effective method to whiten clothes 	how can i achieve the whitest color for my clothes 	what s the best approach to get clothes looking their whitest 	what technique is best for whitening clothes 	what s the most efficient way to get clothes white 	how do i get my clothes to their whitest state 	what s the simplest way to whiten clothes 	what s the most practical method to get clothes white 	what s the best way to make my clothes look their whitest 	how can i get my clothes to be their whitest 	what s the most popular way to whiten clothes 	what s the most common method to get clothes white 	what s the best technique for whitening clothes 	what s the most effective way to get clothes looking their best 	how can i achieve the brightest color for my clothes 	what s the most reliable way to get clothes white 	what s the most trusted method to whiten clothes 	what s the most efficient technique for getting clothes white 	what s the simplest method to whiten clothes 	what s the most practical technique for getting clothes white 
1109707	what medium do radio waves travel through	 what medium do radio waves traverse 	what substance do radio waves propagate through 	in what environment do radio waves transmit 	what pathway do radio waves follow 	what material do radio waves pass through 	what terrain do radio waves cover 	what channel do radio waves broadcast through 	what waveguide do radio waves travel along 	what conduit do radio waves use 	what route do radio waves take 	what vessel do radio waves navigate 	what arena do radio waves occupy 	what sphere do radio waves inhabit 	what domain do radio waves operate in 	what realm do radio waves inhabit 	what expanse do radio waves traverse 	what range do radio waves span 	what scope do radio waves cover 	what span do radio waves occupy 	what expanse do radio waves cover  
1110678	what is the un fao	 what is the un fao 	what does un fao stand for 	what is the meaning of un fao 	what does fao stand for in the un 	what is the united nations food and agriculture organization 	what is the un s food and agriculture organization 	what is the food and agriculture organization of the united nations 	what is the un s fao 	what does the un fao do 	what is the purpose of the un fao 	what is the un fao s role 	what is the un s food and agriculture organization s role 	what does the un fao stand for 	what is the un fao s purpose 	what is the united nations  food and agriculture organization s purpose 	what is the un s food and agriculture organization s meaning 	what does the un fao s name mean 	what is the meaning of the un fao s name 	what is the un fao s definition 	what does the un fao define 
1113256	what is reba mcentire s net worth	 what is reba mcentire s net worth 	what is the net worth of reba mcentire 	reba mcentire s net worth  how much is it 	how much is reba mcentire s net worth 	what is reba mcentire s financial worth 	reba mcentire s fortune  what is it 	what is the financial worth of reba mcentire 	reba mcentire s net value  what is it 	reba mcentire s wealth  how much is it 	what is reba mcentire s monetary worth 	reba mcentire s assets  what is the value 	what is the value of reba mcentire s assets 	reba mcentire s net income  how much is it 	reba mcentire s net assets  what is the value 	what is reba mcentire s financial situation 	reba mcentire s financial standing  what is it 	reba mcentire s monetary situation  how much is it 	what is the financial standing of reba mcentire 	reba mcentire s wealth status  what is it 	what is reba mcentire s financial position 
1115210	what is chaff and flare	 what s the significance of chaff and flare 	can you explain the meaning of chaff and flare 	what s chaff and flare all about 	what do chaff and flare represent 	can you define chaff and flare 	what s the purpose of chaff and flare 	what s the difference between chaff and flare 	what s the importance of chaff and flare 	what s the significance of chaff and flare in a specific context 	what does chaff and flare entail 	what s the scope of chaff and flare 	what s the role of chaff and flare 	what s the function of chaff and flare 	what s the essence of chaff and flare 	what s the core of chaff and flare 	what s the heart of chaff and flare 	what s the gist of chaff and flare 	what s the crux of chaff and flare 	what s the substance of chaff and flare 	what s the meat of chaff and flare 
1116380	what is a nonconformity earth science	 what is a geological anomaly	what is a nonconformity earth science	what is a nonconformity earth science	what is a nonconformity earth science	what is a nonconformity earth science	what is a nonconformity earth science	what is a nonconformity earth science	what is a nonconformity earth science	what is a nonconformity earth science	what is a nonconformity earth science	what is a nonconformity earth science	what is a nonconformity earth science	what is a nonconformity earth science	what is a nonconformity earth science	what is a nonconformity earth science	what is a nonconformity earth science	what is a nonconformity earth science	what is a nonconformity earth science	what is a nonconformity earth science	what is a nonconformity earth science
1121353	what can you do about discrimination in the workplace in oklahoma city	 what can be done to combat workplace discrimination in oklahoma city 	how can one address discrimination issues in okc workplaces 	what steps can be taken to prevent discrimination in oklahoma city workplaces 	what are some ways to handle discrimination in the workplace in okc 	what strategies can be employed to reduce discrimination in oklahoma city workspaces 	how can employers address discrimination in oklahoma city 	what can be done to promote a discrimination free workplace in okc 	what measures can be taken to eliminate discrimination in oklahoma city 	how can discrimination be addressed in okc workplaces 	what initiatives can be implemented to combat discrimination in oklahoma city 	what actions can be taken to prevent discrimination in okc workplaces 	what methods can be used to reduce discrimination in oklahoma city 	how can one report discrimination in oklahoma city workplaces 	what can be done to stop discrimination in okc workplaces 	what steps can be taken to address discrimination in oklahoma city 	what strategies can be used to prevent discrimination in okc workplaces 	what measures can be implemented to reduce discrimination in oklahoma city 	how can discrimination be handled in okc workplaces 	what initiatives can be taken to promote a discrimination free workplace in okc 	what actions can be taken to address discrimination in oklahoma city workplaces 
1122767	what amino produces carnitine	 what amino acid is responsible for producing carnitine 	which amino acid synthesizes carnitine 	what amino acid produces carnitine 	carnitine producing amino acid	what amino acid is the source of carnitine 	which amino acid is the precursor to carnitine 	what amino acid is converted to carnitine 	the amino acid responsible for carnitine production	what amino acid is the building block of carnitine 	which amino acid is the foundation of carnitine 	what amino acid is the raw material for carnitine 	carnitine producing amino acid synthesis	what amino acid is the catalyst for carnitine production 	what amino acid is the key to carnitine synthesis 	what amino acid is the driving force behind carnitine production 	what amino acid is the trigger for carnitine synthesis 	the amino acid that gives rise to carnitine	what amino acid is the genesis of carnitine 	what amino acid is the spark that ignites carnitine production 	the amino acid that produces carnitine
1127540	meaning of shebang	 meaning of the shebang	what does the shebang signify	interpretation of shebang	significance of shebang	understanding shebang	what s the meaning of shebang	explanation of shebang	definition of shebang	the significance of shebang	what does shebang mean	meaning behind shebang	significance of the shebang	what s the significance of shebang	explanation of the shebang	the meaning of shebang	what s shebang all about	the significance of shebang in context	what does shebang  mean	what s the definition of shebang	what is the meaning of shebang
1131069	how many sons robert kraft has	 how many boy children does robert kraft have 	how many male offspring does robert kraft possess 	what is the number of sons robert kraft has 	"robert kraft s son count, please "	how many sons does robert kraft have in total 	what is the quantity of sons robert kraft has 	"number of sons owned by robert kraft, if you please "	how many male children does robert kraft have in his family 	what is the total number of sons robert kraft has 	"robert kraft s sons  count, if available "	how many sons does robert kraft have in his household 	what is the exact number of sons robert kraft has 	"count of sons belonging to robert kraft, please "	how many sons does robert kraft possess in his family 	what is the sum of sons robert kraft has 	"robert kraft s sons  tally, please "	how many sons does robert kraft have in his entire family 	what is the number of sons robert kraft has in his family tree 	how many male offspring does robert kraft have in his family 	what is the total count of sons robert kraft has 
1132532	average annual income data analyst	 mean annual compensation for data analyst	annual salary of a data analyst on average	median income for data analysts	typical yearly earnings of a data analyst	data analyst s average annual remuneration	income statistics for data analysts	average yearly income for data analysts	data analyst s average salary	average annual compensation package for data analysts	data analyst s median income	average income of a data analyst	yearly average salary for data analysts	data analyst s typical income	average annual income of data analysts	data analyst s yearly compensation	annual income average for data analysts	data analyst s average yearly earnings	average income for data analysts	data analyst s salary statistics	average annual income range for data analysts
1133579	how does granulation tissue start	 how does granulation tissue begin	how does granulation tissue start	how does granulation tissue start	how does granulation tissue start	how does granulation tissue start	how does granulation tissue start	how does granulation tissue start	how does granulation tissue start	how does granulation tissue start	how does granulation tissue start	how does granulation tissue start	how does granulation tissue start	how does granulation tissue start	how does granulation tissue start	how does granulation tissue start	how does granulation tissue start	how does granulation tissue start	how does granulation tissue start	how does granulation tissue start	how does granulation tissue start
1136043	difference between a hotel and motel	 what s the distinction between a hotel and motel 	how do hotels differ from motels 	what s the main difference between a hotel and a motel 	in what ways do hotels and motels diverge 	can you outline the differences between hotels and motels 	how do hotels and motels compare 	what are the key differences between a hotel and a motel 	in what respects do hotels and motels differ 	what are the main distinctions between hotels and motels 	are there any notable differences between hotels and motels 	can you describe the differences between hotels and motels 	how do hotels and motels vary 	what s the difference between a hotel and a motel in terms of amenities 	what are the primary differences between hotels and motels 	do hotels and motels have distinct characteristics 	what s the main difference between a hotel and a motel in terms of service 	are hotels and motels fundamentally different 	can you identify the differences between hotels and motels 	what s the distinction between hotels and motels in terms of location 	how do hotels and motels differ in terms of facilities 
1136047	difference between a company s strategy and business model is	 what sets a company s strategy apart from its business model	how does a company s strategy diverge from its business model	what distinguishes a company s strategy from its business model	in what ways does a company s strategy differ from its business model	how can a company s strategy be distinguished from its business model	what are the key differences between a company s strategy and business model	can a company s strategy be differentiated from its business model	what are the main distinctions between a company s strategy and business model	how does a company s strategy differ in terms of its business model	what are the essential differences between a company s strategy and business model	how can a company s business model be distinguished from its strategy	what is the fundamental difference between a company s strategy and business model	what are the primary differences between a company s strategy and business model	in what respects does a company s strategy differ from its business model	how does a company s strategy contrast with its business model	what are the primary distinctions between a company s strategy and business model	how does a company s strategy diverge from its business model	what sets a company s business model apart from its strategy	how does a company s strategy differ from its business model in terms of	what are the main differences between a company s strategy and business model in terms of
1136962	why did the ancient egyptians call their land kemet or black land	" what did the ancient egyptians mean by referring to their homeland as kemet, also known as the black land "	in what sense did the ancient egyptians use the term kemet to describe their territory 	"why did the ancient egyptians dub their land  kemet , which translates to  black land  "	what was the significance of the name  kemet  to the ancient egyptians 	"why did the ancient egyptians call their land  kemet , which literally means  black land  "	what was the motivation behind the ancient egyptians  choice of  kemet  as the name for their homeland 	can you explain the etymology of the term  kemet  and its relevance to the ancient egyptians 	"why did the ancient egyptians use  kemet  to describe their land, and what does it imply "	what did the term  kemet  convey to the ancient egyptians about their identity and culture 	"why did the ancient egyptians choose  kemet  as the name for their land, and what were the implications "	in what ways did the ancient egyptians  use of  kemet  reflect their understanding of their environment 	what does the term  kemet  reveal about the ancient egyptians  relationship with their land 	"why did the ancient egyptians refer to their land as  kemet , and what did it mean to them "	what was the symbolic significance of  kemet  to the ancient egyptians 	why did the ancient egyptians use the term  black land  to describe their homeland 	what did the term  black land  convey to the ancient egyptians about their land and its characteristics 	why did the ancient egyptians choose  black land  as the name for their territory 	what were the connotations associated with the term  black land  in ancient egyptian culture 	can you explain the historical context in which the term  kemet  emerged and its significance 	why did the ancient egyptians  use of  kemet  vary across different regions and time periods 
118440	define bmt medical	 define bmt medical treatment	explain the concept of bone marrow transplantation	what is bmt medical procedure	describe bone marrow transplant process	define bmt medical terminology	explain bone marrow transplant medical definition	what is the meaning of bmt medical	define bone marrow transplant medical term	explain the significance of bmt medical	what is the definition of bmt medical	define medical bone marrow transplant	explain the concept of bmt medical treatment	what is the meaning of bone marrow transplant	define medical bmt procedure	explain bmt medical terminology	what is the definition of bone marrow transplant	define bmt medical definition	explain medical bone marrow transplant	what is bmt medical procedure definition	define medical bmt treatment
121171	define etruscans	 who were the etruscans 	what is the meaning of etruscan 	describe the etruscan civilization	define  etruscan  in historical context	explain the significance of etruscans	what do we know about etruscans 	define  etruscans  in archaeology	what is the etruscan culture like 	describe the etruscan people	define  etruscan  in anthropology	what is the etruscan language 	define  etruscans  in linguistics	who were the ancient etruscans 	what is the etruscan mythology 	define  etruscan  in mythology	what is the etruscan art like 	define  etruscans  in art history	what is the etruscan architecture like 	define  etruscan  in architecture	describe the etruscan way of life
135802	definition of laudable	 praiseworthy concept	commendable notion	admired principle	worthy of praise	deserving of admiration	meritorious idea	excellent quality	admirable trait	praiseful notion	glorifying principle	exalted concept	honorable attribute	commendable quality	praiseworthy characteristic	deserving of commendation	meritorious principle	excellent notion	admirable concept	glorifying notion	exalted attribute
