174463	dog day afternoon meaning	 dog day afternoon meaning	meaning of dog day afternoon	what does dog day afternoon mean	dog day afternoon definition	explain dog day afternoon meaning	meaning behind dog day afternoon	dog day afternoon symbolism	what is dog day afternoon	meaning of the phrase dog day afternoon	dog day afternoon phrase meaning	meaning of dog day afternoon phrase	dog day afternoon phrase definition	dog day afternoon idiomatic meaning	idiomatic meaning of dog day afternoon	dog day afternoon colloquial meaning	colloquial meaning of dog day afternoon	meaning of dog day afternoon in english	dog day afternoon english meaning	meaning of dog day afternoon phrase in english	phrase meaning of dog day afternoon in english
23849	are naturalization records public information	 are naturalization records public information in the united states 	are naturalization records public information in the us 	are naturalization records publicly available 	are naturalization records publicly accessible 	are naturalization records publicly disclosed 	are naturalization records publicly released 	are naturalization records publicly shared 	are naturalization records publicly documented 	are naturalization records publicly filed 	are naturalization records publicly stored 	are naturalization records publicly held 	are naturalization records publicly maintained 	are naturalization records publicly archived 	are naturalization records publicly preserved 	are naturalization records publicly displayed 	are naturalization records publicly searchable 	are naturalization records publicly indexable 	are naturalization records publicly retrievable 	are naturalization records publicly accessible by the public 	are naturalization records publicly accessible online 
258062	how long does it take to remove wisdom tooth	 how long does it take to remove wisdom tooth under general anesthesia	how long does it take to remove wisdom tooth with iv sedation	how long does it take to remove wisdom tooth for a 25 year old	how long does it take to remove wisdom tooth with a complex extraction	how long does it take to remove wisdom tooth with a simple extraction	how long does it take to remove wisdom tooth for a patient with a small jaw	how long does it take to remove wisdom tooth for a patient with a large jaw	how long does it take to remove wisdom tooth in a hospital	how long does it take to remove wisdom tooth in a dental office	how long does it take to remove wisdom tooth with a local anesthetic	how long does it take to remove wisdom tooth with a general anesthetic	how long does it take to remove wisdom tooth with a sedative	how long does it take to remove wisdom tooth with a combination of anesthetics	how long does it take to remove wisdom tooth in a 30 minute appointment	how long does it take to remove wisdom tooth in a 1 hour appointment	how long does it take to remove wisdom tooth with a bone graft	how long does it take to remove wisdom tooth with a sinus lift	how long does it take to remove wisdom tooth with a dental implant	how long does it take to remove wisdom tooth with a dental crown	how long does it take to remove wisdom tooth with a dental bridge
324585	how much money do motivational speakers make	 how much money do successful motivational speakers make	how much money do famous motivational speakers make	how much money do well known motivational speakers make	how much money do popular motivational speakers make	how much money do top motivational speakers make	how much money do high paid motivational speakers make	how much money do top earning motivational speakers make	how much money do motivational speakers with big followings make	how much money do motivational speakers with large audiences make	how much money do motivational speakers with millions of followers make	how much money do motivational speakers with successful books make	how much money do motivational speakers with successful podcasts make	how much money do motivational speakers with successful tv shows make	how much money do motivational speakers with successful courses make	how much money do motivational speakers with successful coaching services make	how much money do motivational speakers with successful speaking engagements make	how much money do motivational speakers with successful events make	how much money do motivational speakers with successful conferences make	how much money do motivational speakers with successful seminars make	how much money do motivational speakers with successful workshops make
330975	how much would it cost to install my own wind turbine	 how much would it cost to install my own wind turbine in the united states	how much would it cost to install a residential wind turbine	what is the cost of installing a personal wind turbine	how much does it cost to install a small wind turbine	what is the installation cost of a home wind turbine	how much would it cost to install a diy wind turbine	what is the cost of building a wind turbine for personal use	how much would it cost to install a wind turbine on my property	what is the installation cost of a commercial wind turbine	how much would it cost to install a wind turbine in my backyard	what is the cost of installing a wind turbine for a small farm	how much would it cost to install a wind turbine for a rural home	what is the installation cost of a community wind turbine	how much would it cost to install a wind turbine on a hill	what is the cost of installing a wind turbine on a rooftop	how much would it cost to install a wind turbine in a wind farm	what is the installation cost of a wind turbine for a research project	how much would it cost to install a wind turbine in a remote area	what is the cost of installing a wind turbine for a non profit organization	how much would it cost to install a wind turbine in a urban area
332593	how often to button quail lay eggs	 how often do button quail lay eggs	button quail egg laying frequency	how often do button quails lay eggs	egg laying frequency in button quails	button quail egg production schedule	quail egg laying habits button quail	button quail reproductive cycle	how often button quail lay eggs	button quail egg laying routine	quail egg production frequency button quail	button quail breeding schedule	egg laying patterns button quail	button quail egg laying habits	quail egg laying frequency button quail	button quail reproductive habits	how often do button quail lay	quail egg production button quail	button quail egg laying schedule	quail egg laying habits button quail	button quail egg laying frequency daily
336901	how old is vanessa redgrave	 vanessa redgrave s age	vanessa redgrave current age	how old is vanessa redgrave now	age of vanessa redgrave	vanessa redgrave s current age	age of the actress vanessa redgrave	vanessa redgrave s age today	what is vanessa redgrave s age	age of the british actress vanessa redgrave	vanessa redgrave s birthdate	when was vanessa redgrave born	what age is vanessa redgrave	age of vanessa redgrave the actress	vanessa redgrave s age in years	age of vanessa redgrave the british actress	how old is the actress vanessa redgrave	vanessa redgrave s age today s date	what is the age of vanessa redgrave	age of vanessa redgrave the renowned actress	vanessa redgrave s birth year
390360	ia suffix meaning	 ia suffix meaning in english	meaning of ia suffix	ia suffix definition	what does ia suffix mean	meaning of suffix ia	ia suffix explanation	meaning of suffix meaning	what is ia suffix	ia suffix significance	meaning of ia suffix in linguistics	meaning of ia suffix in grammar	ia suffix meaning in linguistics	ia suffix meaning in language	meaning of suffix ia in english	what does suffix ia mean	ia suffix meaning in words	meaning of suffix ia in language	ia suffix meaning examples	meaning of suffix ia definition	ia suffix meaning in dictionary
405163	is caffeine an narcotic	 is  caffeine  a  narcotic  drug 	is caffeine an narcotic	is caffeine an narcotic	is caffeine an narcotic	is caffeine an narcotic	is caffeine an narcotic	is caffeine an narcotic	is caffeine an narcotic	is caffeine an narcotic	is caffeine an narcotic	is caffeine an narcotic	is caffeine an narcotic	is caffeine an narcotic	is caffeine an narcotic	is caffeine an narcotic	is caffeine an narcotic	is caffeine an narcotic	is caffeine an narcotic	is caffeine an narcotic	is caffeine an narcotic
42255	average salary for dental hygienist in nebraska	 average salary for dental hygienist in nebraska	average salary for dental hygienist in nebraska	average salary for dental hygienist in nebraska	average salary for dental hygienist in nebraska	average salary for dental hygienist in nebraska	average salary for dental hygienist in nebraska	average salary for dental hygienist in nebraska	average salary for dental hygienist in nebraska	average salary for dental hygienist in nebraska	average salary for dental hygienist in nebraska	average salary for dental hygienist in nebraska	average salary for dental hygienist in nebraska	average salary for dental hygienist in nebraska	average salary for dental hygienist in nebraska	average salary for dental hygienist in nebraska	average salary for dental hygienist in nebraska	average salary for dental hygienist in nebraska	average salary for dental hygienist in nebraska	average salary for dental hygienist in nebraska	average salary for dental hygienist in nebraska
47210	average wedding dress alteration cost	 average wedding dress alteration cost in new york	average cost of wedding dress alterations	average wedding dress alterations price	average cost of custom wedding dress alterations	average wedding dress alteration prices	average cost of wedding dress alterations uk	average cost of wedding dress alterations in us	average cost of wedding dress alterations for plus size	average cost of wedding dress alterations for petite	average cost of wedding dress alterations for strapless	average cost of wedding dress alterations for mermaid	average cost of wedding dress alterations for ball gown	average cost of wedding dress alterations for a line	average cost of wedding dress alterations for high low	average cost of wedding dress alterations for tea length	average cost of wedding dress alterations for lace	average cost of wedding dress alterations for satin	average cost of wedding dress alterations for beaded	average cost of wedding dress alterations for embroidered	average cost of wedding dress alterations for sequined
555530	what are best foods to lower cholesterol	 what are best foods to lower cholesterol levels naturally	best foods to lower cholesterol for vegetarians	foods that help lower cholesterol quickly	best foods to lower cholesterol in elderly	foods that lower cholesterol and triglycerides	what foods can help lower cholesterol levels	best foods to lower cholesterol and blood pressure	foods that can lower cholesterol without medication	best foods to lower cholesterol for kids	foods that help lower cholesterol and improve heart health	what are the best foods to lower cholesterol naturally	foods that lower cholesterol and improve circulation	best foods to lower cholesterol and reduce inflammation	foods that can help lower cholesterol in 30 days	best foods to lower cholesterol and improve digestion	foods that lower cholesterol and reduce plaque	what foods can lower cholesterol and triglycerides	best foods to lower cholesterol and improve overall health	foods that help lower cholesterol and reduce risk of heart disease	best foods to lower cholesterol and improve skin health
583468	what carvedilol used for	 what carvedilol used for hypertension treatment	what carvedilol used for high blood pressure treatment	what carvedilol used for heart failure treatment	what carvedilol used for cardiovascular disease treatment	what carvedilol used for chronic heart failure treatment	what carvedilol used for mild heart failure treatment	what carvedilol used for severe heart failure treatment	what carvedilol used for left ventricular dysfunction treatment	what carvedilol used for angina treatment	what carvedilol used for coronary artery disease treatment	what carvedilol used for myocardial infarction treatment	what carvedilol used for post myocardial infarction treatment	what carvedilol used for atrial fibrillation treatment	what carvedilol used for essential hypertension treatment	what carvedilol used for resistant hypertension treatment	what carvedilol used for hypertensive crisis treatment	what carvedilol used for cardiomyopathy treatment	what carvedilol used for cardiac arrhythmia treatment	what carvedilol used for vasodilator treatment	what carvedilol used for beta blocker treatment 
640502	what does it mean if your tsh is low	 what does it mean if your tsh is low	what does it mean if your tsh is low	what does it mean if your tsh is low	what does it mean if your tsh is low	what does it mean if your tsh is low	what does it mean if your tsh is low	what does it mean if your tsh is low	what does it mean if your tsh is low	what does it mean if your tsh is low	what does it mean if your tsh is low	what does it mean if your tsh is low	what does it mean if your tsh is low	what does it mean if your tsh is low	what does it mean if your tsh is low	what does it mean if your tsh is low	what does it mean if your tsh is low	what does it mean if your tsh is low	what does it mean if your tsh is low	what does it mean if your tsh is low	what does it mean if your tsh is low
67316	can fever cause miscarriage early pregnancy	 can a fever in early pregnancy cause miscarriage	can a fever during early pregnancy cause miscarriage	can fever cause miscarriage in the first trimester of pregnancy	can fever cause miscarriage in early stages of pregnancy	does a fever increase the risk of miscarriage in early pregnancy	can a fever in the first 12 weeks of pregnancy cause miscarriage	can a fever in the first 10 weeks of pregnancy cause miscarriage	can a fever in the first 8 weeks of pregnancy cause miscarriage	can a fever in the first 6 weeks of pregnancy cause miscarriage	can a fever in the first 4 weeks of pregnancy cause miscarriage	can a fever in the first 2 weeks of pregnancy cause miscarriage	can a fever in the first trimester of pregnancy cause miscarriage	can a fever in the early stages of pregnancy cause miscarriage	can a fever in the early weeks of pregnancy cause miscarriage	can a fever in the early days of pregnancy cause miscarriage	can a fever in the early stages of early pregnancy cause miscarriage	can a fever in the first few weeks of pregnancy cause miscarriage	can a fever in the first few days of pregnancy cause miscarriage	can a fever in the early weeks of early pregnancy cause miscarriage	can a fever in the early days of early pregnancy cause miscarriage
673670	what is a alm	 what is a almond	what is an alm	what is a almon	what is a alm tree	what is a almond tree	what is a almon tree	what is a type of alm	what is a type of almond	what is a species of alm	what is a species of almond	what is the meaning of alm	what is the definition of alm	what is a synonym for alm	what is the origin of alm	what is the history of alm	what is a characteristic of alm	what is a feature of alm	what is a property of alm	what is a fact about alm	what is a detail about almond
701453	what is a statutory deed	 what is a statutory deed	definition of statutory deed	what is meant by statutory deed	statutory deed meaning	what is the purpose of a statutory deed	what is included in a statutory deed	types of statutory deeds	requirements for a statutory deed	what is the difference between a statutory deed and a non statutory deed	statutory deed vs non statutory deed	statutory deed examples	statutory deed format	statutory deed contents	statutory deed templates	statutory deed laws	statutory deed regulations	statutory deed requirements by state	statutory deed requirements by country	statutory deed examples in the us	statutory deed examples in the uk
730539	what is chronometer who invented it	 who invented the chronometer	what is chronometer who invented it	what is chronometer who invented it	what is chronometer who invented it	what is chronometer who invented it	what is chronometer who invented it	what is chronometer who invented it	what is chronometer who invented it	what is chronometer who invented it	what is chronometer who invented it	what is chronometer who invented it	what is chronometer who invented it	what is chronometer who invented it	what is chronometer who invented it	what is chronometer who invented it	what is chronometer who invented it	what is chronometer who invented it	what is chronometer who invented it	what is chronometer who invented it	what is chronometer who invented it
768208	what is mamey	 mamey sapote fruit	what is mamey sapote	definition of mamey	mamey sapote characteristics	mamey sapote tree	what does mamey taste like	mamey sapote nutrition facts	mamey sapote benefits	mamey sapote recipe	mamey sapote in cooking	mamey sapote health benefits	mamey sapote seeds	mamey sapote uses	mamey sapote vs sapodilla	what is mamey sapote good for	mamey sapote vs mango	mamey sapote flavor profile	mamey sapote growing conditions	mamey sapote cultivation	mamey sapote history
877809	what metal are hip replacements made of	 what metal are most hip replacements made of	what metal are majority of hip replacements made of	what metal are most common hip replacements made of	what metal are hip replacement joints made of	what metal are hip replacement implants made of	what metal are hip replacement devices made of	what metal are hip replacement prosthetics made of	what metal are hip replacement surgical implants made of	what metal are titanium hip replacements made of	what metal are stainless steel hip replacements made of	what metal are cobalt chrome hip replacements made of	what metal are ceramic hip replacements made of	what metal are ceramic on metal hip replacements made of	what metal are metal on metal hip replacements made of	what metal are ceramic on ceramic hip replacements made of	what metal are ceramic on polyethylene hip replacements made of	what metal are metal on polyethylene hip replacements made of	what metal are titanium alloy hip replacements made of	what metal are cobalt chromium molybdenum hip replacements made of	what metal are stainless steel alloy hip replacements made of
911232	what type of conflict does della face in o henry the gift of the magi	 what type of conflict does della face in o  henry s the gift of the magi 	what type of inner conflict does della face in o  henry s the gift of the magi 	what type of emotional conflict does della face in o  henry s the gift of the magi 	what type of psychological conflict does della face in o  henry s the gift of the magi 	what type of interpersonal conflict does della face in o  henry s the gift of the magi 	what type of social conflict does della face in o  henry s the gift of the magi 	what type of personal conflict does della face in o  henry s the gift of the magi 	what type of struggle does della face in o  henry s the gift of the magi 	what type of struggle with della does o  henry s the gift of the magi depict 	what type of inner struggle does della face in o  henry s the gift of the magi 	what type of emotional struggle does della face in o  henry s the gift of the magi 	what type of psychological struggle does della face in o  henry s the gift of the magi 	what type of interpersonal struggle does della face in o  henry s the gift of the magi 	what type of social struggle does della face in o  henry s the gift of the magi 	what type of personal struggle does della face in o  henry s the gift of the magi 	what type of conflict does jim and della face in o  henry s the gift of the magi 	what type of conflict does the couple face in o  henry s the gift of the magi 	what type of conflict does the protagonists face in o  henry s the gift of the magi 	what type of conflict does o  henry portray in the gift of the magi 	what type of conflict does the story of the gift of the magi depict 
914916	what type of tissue are bronchioles	 what type of epithelial tissue are bronchioles	what type of mucous membrane tissue are bronchioles	what type of respiratory epithelial tissue are bronchioles	what type of pseudostratified columnar epithelial tissue are bronchioles	what type of ciliated epithelial tissue are bronchioles	what type of simple columnar epithelial tissue are bronchioles	what type of cuboidal epithelial tissue are bronchioles	what type of simple squamous epithelial tissue are bronchioles	what type of mesenchymal tissue are bronchioles	what type of connective tissue are bronchioles	what type of loose connective tissue are bronchioles	what type of dense connective tissue are bronchioles	what type of areolar connective tissue are bronchioles	what type of adipose tissue are bronchioles	what type of blood vessel tissue are bronchioles	what type of smooth muscle tissue are bronchioles	what type of skeletal muscle tissue are bronchioles	what type of cardiac muscle tissue are bronchioles	what type of nervous tissue are bronchioles	what type of peripheral nervous tissue are bronchioles
938400	when did family feud come out	 when did family feud originally air 	when was family feud first released 	what year did family feud debut 	when did family feud premiere 	what s the release date of family feud 	when did family feud start 	in what year did family feud start 	when was the first episode of family feud 	what s the air date of family feud 	when did family feud launch 	what year did family feud launch 	when was family feud s first season 	what s the debut date of family feud 	when did family feud become popular 	in what year did family feud become popular 	when was family feud s first season finale 	what s the end date of family feud s first season 	when did family feud end its first season 	what year did family feud end its first season 	when was family feud s first episode
940547	when did rock n roll begin	 when did rock and roll music begin	when did rock n roll emerge	when was rock n roll invented	when did rock and roll music originate	when did rock n roll start	when did rock and roll begin in the united states	when was rock and roll born	when did rock n roll become popular	when did rock and roll music develop	when was rock and roll created	when did rock n roll evolve	when did rock and roll music appear	when was rock and roll first played	when did rock n roll gain popularity	when did rock and roll music spread	when was rock and roll introduced	when did rock n roll become a genre	when did rock and roll music rise	when was rock and roll popularized	when did rock n roll music emerge as a distinct genre
997622	where is the show shameless filmed	 where is the tv show shameless filmed in chicago 	where is the filming location of shameless tv series 	where is shameless tv show set in 	where is the filming location of shameless in illinois 	where is shameless tv series filmed in the united states 	where is the production location of shameless tv show 	where is shameless tv series set in chicago 	where is the filming location of shameless in the midwest 	where is shameless tv show filmed in illinois 	where is the production location of shameless in the united states 	where is shameless tv series filmed in chicago 	where is the filming location of shameless tv series in illinois 	where is shameless tv show set in the united states 	where is the production location of shameless in chicago 	where is shameless tv series filmed in the midwest 	where is the filming location of shameless in the us 	where is shameless tv show set in illinois 	where is the production location of shameless tv series 	where is shameless tv series filmed in the us 	where is the filming location of shameless in the country 
